{
  "document_id": "docling-multi_page",
  "source_revision": "e90f3440e9091b51a9c7fb0b138003933d71f540f24f4d04c05aa58fe3eb747a",
  "fields": {
    "text": "The Evolution of the Word Processor\n\nThe concept of the word processor predates modern computers and has evolved through several technological milestones."
  },
  "metadata": {
    "_rag": {
      "provider": "docling",
      "preview": true
    }
  },
  "structure": {
    "text": {
      "schema_id": "text-spans/0.1-draft",
      "blocks": [
        {
          "block_id": "b0000",
          "type": "heading",
          "locations": [
            {
              "kind": "page",
              "page_number": 1
            }
          ],
          "level": 1,
          "start": 0,
          "end": 35
        },
        {
          "block_id": "b0001",
          "type": "paragraph",
          "locations": [
            {
              "kind": "page",
              "page_number": 1
            }
          ],
          "start": 37,
          "end": 154
        }
      ]
    }
  }
}
